oracion,etiqueta
el dos me veinticuatro y gimnasio gasté treinta con euros mil novecientos,gasto
desembolsé doscientos setenta con,gasto
pagué ciento nueve con,gasto
una paga atrasada me cayeron mil quince con ochenta y uno euros de,ingreso
mil trescientos setenta y dos con treinta y cinco euros por un vuelo pagué cuatro,gasto
aboné tres mil setecientos,gasto
desembolsé doscientos sesenta,gasto
me cobraro novecientos ochenta con veintiuno euros por un regalo en enero,gasto
me cayeron mil novecientos,ingreso
aboné mil novecientos treinta euros de un vuelo,gasto
en la compra he desembolsado cuatro mil uno euros,gasto
pagué tres mil ciento seis con sesenta y siete euros por gasolina,gasto
sesenta setecientos siete desembolsado y euros veintinueve con he ropa,gasto
he desembolsado cuatro mil,gasto
por una reparación,gasto
me han abonado cuatro mil setecientos sesenta y uno con treinta y nueve euros de una herencia,ingreso
treinta y cuatro con sesenta y cinco euros este mes en el súper pagué doscientos,gasto
me de de ingreso un euros este nómina mes cinco,ingreso
me cobraron quinientos cuarenta,gasto
salón euros para en seiscientos desembolsé mobiliario,gasto
me han abonado ciento diecisiete con veintiocho euros de una transferencia,ingreso
cincuenta y tres euros de una ayuda municipal este mes he percibido,ingreso
ingresé en euros documento veinticuatro por con total un traducir treinta,ingreso
cuatro mil trescientos treinta y uno euros por una apuesta me pagaron,ingreso
el mes pasado,ingreso
me abonaron dos,ingreso
cobré cuatro mil cuatrocientos cuarenta y dos con veintiséis euros por una devolución,ingreso
por un bonus me pagaron trescientos noventa y nueve con ochenta y tres euros,ingreso
en una reforma me dejé tres mil trescientos setenta y cinco euros ayer,gasto
euros de ropa,gasto
me tres total en ciento en gestoría la euros,gasto
encuesta remunerada recientemente me ingresaro dos mil cuarenta y ocho con diez euros de una,ingreso
me gasté mil,gasto
he desembolsado cuatro mil,gasto
de la luz,gasto
me cobraron cuatro mil,gasto
por una reparación pagué cuatro mil quinientos dieciocho con setenta y seis euros,gasto
vuelo aboné dos mil seiscientos sesenta y cuatro euros de un,gasto
me abonaron dos,ingreso
mil novecientos veinticuatro con treinta y dos euros en el gimnasio me gasté,gasto
por una transferencia cobré ciento veinticuatro con dieciocho euros,ingreso
me cobraro tres mil,gasto
me entraron dieciocho con,ingreso
dos treinta de y euros ochenta y herencia mil ingresaron dos siete una me con,ingreso
cuatro mil veintiséis con noventa y nueve euros en la compra me gasté,gasto
he percibido trescientos,ingreso
taller y se ochocientos fueron coche pagar dos tres el mil me para cincuenta euros,gasto
la le para hice un cena veinte de a bizum ana,gasto
me pagaron seiscientos cincuenta y cinco euros por una beca,ingreso
me pagaron ciento cincuenta,ingreso
para euros gastado he tres y con vuelo ochenta pagar seiscientos un,gasto
he gastado novecientos setenta euros esta semana en el fisioterapeuta,gasto
por el supermercado,gasto
cliente este mes,ingreso
poco se fueron tres mil trescientos noventa y ocho euros con un curso online hace,gasto
mil doscientos cinco euros de pensión de viudedad el mes pasado he ingresado,ingreso
pague un cargo de cien euros,gasto
uno este euros seiscientos concierto mes aboné un y sesenta,gasto
me han cargado,gasto
me han transferido,ingreso
una de veinticuatro subvención entraron ayer euros me dieciocho,ingreso
han y transferido seis euros mes noventa me por este proyecto freelance,ingreso
se me fueron,gasto
solté sesenta y dos euros ayer en el cerrajero,gasto
he desembolsado mil doscientos,gasto
pendiente y deuda recibí por euros una dos esta cincuenta,ingreso
me cayeron dos mil,ingreso
finde gasté ciento cincuenta euros en ikea el,gasto
con cuarenta uno euros en y y cuatro setenta me trescientos cobraron,gasto
he desembolsado cuatro mil cuatrocientos cincuenta y dos con cincuenta y cuatro euros en el supermercado,gasto
me han cargado treinta,gasto
mes en ropa solté dos mil trescientos veinticinco euros este,gasto
me han pasado,gasto
me ingresaro ciento veintiuno con sesenta y cinco euros de un bonus,ingreso
me han pagado,ingreso
invertí dos mil quinientos,gasto
aeropuerto pagué cincuenta y cinco euros de taxi al,gasto
gasté quinientos euros en un billete de tren,gasto
desayuno en enero,gasto
me han cargado,gasto
y dos euros de la venta del sofá esta semana ingresé cuarenta,ingreso
pagué cuatro mil doscientos veintiuno con sesenta euros por netflix,gasto
invertí quinientos once euros,gasto
portátil el viernes solté setecientos ochenta y tres con setenta y ocho euros de un,gasto
se me ingresaron novecientos,ingreso
durante tres la solté el con hipoteca euros mil cuarenta diecinueve y finde,gasto
en la hipoteca,gasto
tuve que pagar,gasto
nueve me cobrado de icloud y noventa han,gasto
euros por nómina he percibido tres mil once con ochenta y tres,ingreso
se fueron doscientos,gasto
mil euros tres coche que tuve unos la y revisión del setenta ocho pagar por,gasto
en cuatro marzo mil ochocientos me cuatro de ochenta intereses y abonaron,ingreso
doscientos euros el taller del coche me cobró,gasto
herencia he percibido setecientos cinco con tres euros por una,ingreso
he percibido tres mil ochocientos cincuenta y seis con setenta euros por una ayuda,ingreso
mil abonado uno herencia dos con cuarenta de han y me doscientos una,ingreso
asesoría me entraron aproximadamente doscientos ochenta y cuatro con treinta y seis euros por una,ingreso
he pagado mil ciento veinticuatro con sesenta y tres euros en una reparación,gasto
me abonaro aproximadamente cuatrocientos,ingreso
he percibido trescientos,ingreso
novecientos sesenta y cuatro euros de la devolución del irpf me pagaron,ingreso
cobré dos mil ochocientos sesenta y ocho euros por nómina,ingreso
obtuve ciento sesenta y ocho euros de la ayuda al alquiler este mes,ingreso
reparar el tejado,gasto
veinticinco euros gasté mercadillo el,gasto
mil ciento cuarenta y cinco con treinta y uno euros por una herencia he percibido,ingreso
euros de salario se me ingresaro alrededor de doscientos cincuenta y cuatro,ingreso
por una beca,ingreso
setenta el gasté con gimnasio en me y y treinta dos cuatro euros,gasto
de una cena aboné tres mil ochocientos uno con sesenta euros,gasto
me abonaro alrededor de tres mil cuatrocientos treinta y cuatro euros de una herencia,ingreso
desembolsé dos mil,gasto
me cayeron dos mil,ingreso
dieciséis con veinticuatro euros de una beca recibí doscientos,ingreso
ingresé euros catorce por treinta tres una transferencia con,ingreso
de un bonus me ingresaron ciento veintiuno con sesenta y cinco euros,ingreso
suscripción he desembolsado mil ciento diecisiete con cuarenta y cinco euros en una,gasto
me tocó pagar mil seiscientos cuarenta y siete con veintidós euros ayer en una consulta médica,gasto
me han soltado doscientos sesenta y uno con cincuenta y cuatro euros de honorarios como autónomo hoy,ingreso
ventas este mes me abonó sesenta y nueve euros de comisión por,ingreso
mil cuatrocientos ochenta y tres con veinte euros en el alquiler he desembolsado,gasto
pagué setecientos cincuenta,gasto
venta ingresé dos mil ochocientos cincuenta y siete con noventa y siete euros por una,ingreso
supermercado he pagado mil seiscientos veintinueve euros en el,gasto
se me fueron doscientos,gasto
gasté ciento setenta,gasto
por una herencia he percibido mil doscientos sesenta con cuarenta y ocho euros,ingreso
novecientos ochenta y tres euros para pagar el cerrajero he gastado,gasto
beca recibí cuatrocientos cuarenta y ocho euros de una,ingreso
ingresé cuatro mil,ingreso
sesenta por mil cobré cuatrocientos bonus tres y euros dos,ingreso
beca he percibido trescientos sesenta y dos con cincuenta y siete euros por una,ingreso
el pan me ha costado dos euros,gasto
me han abonado cuatrocientos,ingreso
se fueron cincuenta,gasto
extra por fin me han transferido cuatrocientos noventa y ocho con cincuenta y siete euros por horas,ingreso
tarjeta me han abonado noventa euros de cashback de la,ingreso
durante el finde me cobraro cuatrocientos euros con la farmacia,gasto
doscientos euros a mi madre para la compra le di,gasto
me han soltado seiscientos cincuenta euros por el trabajo de diseño,ingreso
me han pasado sesenta y cinco euros de spotify familiar,gasto
he cobrado cuatro mil,ingreso
me ingresaron tres mil,ingreso
sesenta y seis con cuarenta y siete euros de una reparación aboné novecientos,gasto
y el mil cuatro treinta gimnasio euros desembolsado he siete ochocientos,gasto
me han soltado doscientos,ingreso
me han cobrado doscientos,gasto
desembolsé casi dos mil cuatrocientos euros por el electricista,gasto
setenta este por he cinco ganada tres y una euros mil mes ingresado,ingreso
dos mil doscientos catorce con treinta y uno euros de un proyecto me ingresaron,ingreso
cobré dos mil setecientos,ingreso
por cinco me el y cobró cincuenta avería euros la,gasto
he soltado en total,gasto
transferencia me han cargado ocho euros de comisión por,gasto
cincuenta y ocho con nueve euros para pagar libros me cobraron,gasto
solté mil quinientos,gasto
me cayeron mil cuatrocientos,ingreso
percibí tres mil novecientos cinco euros de una venta en wallapop,ingreso
por una venta cobré dos mil quinientos noventa y siete con sesenta euros,ingreso
de disney plus,gasto
euros en zara gasté sesenta,gasto
un treinta proyecto cobré tres euros por y con mil ochenta dos,ingreso
recibí dos mil,ingreso
euros me dos ayer pagar reforma setenta tocó mil con en una,gasto
me cobraron cuatro mil,gasto
ventas este mes he ingresado trescientos cincuenta y nueve con setenta y tres euros de comisión por,ingreso
he desembolsado mil novecientos veintiséis euros en una reparación,gasto
he percibido tres mil once con ochenta y tres euros por nómina,ingreso
nueve me euros cobraron y noventa y seis ochocientos dentista noventa en el,gasto
intereses en marzo me abonaron cuatro mil ochocientos ochenta y cuatro euros de,ingreso
euros vender cobré por vinted sesenta en,ingreso
me abonaron cuatro,ingreso
gasté mil ciento,gasto
en un vuelo he desembolsado tres mil setecientos ochenta y cuatro con sesenta y cinco euros,gasto
un trabajo freelance,ingreso
diez pagado mil en el veintidós alquiler he euros cuatro,gasto
euros mil nueve una cuatro trescientos con en veintisiete me y reparación gasté,gasto
uno cena fueron mil en y tres cincuenta y treinta me euros se con una,gasto
un móvil nuevo he tenido que abonar cuatro mil noventa y siete euros este mes en,gasto
mil seiscientos sesenta y cuatro euros de un vuelo aboné dos,gasto
gimnasio me gasté setecientos treinta y cuatro con setenta y dos euros en el,gasto
de una cena,gasto
dos mil ochocientos cuarenta y dos euros por un bonus he percibido,ingreso
doscientos euros y mudanza setenta una menos en con siete o más seis cobraron noventa me,gasto
me costó doscientos,gasto
el mes euros he pasado cinco viudedad pensión doscientos ingresado mil de,ingreso
me abonaron aproximadamente,ingreso
por una transferencia cobré tres mil ochocientos dos euros,ingreso
compra me gasté tres mil quinientos cuarenta y nueve con cinco euros en la,gasto
he percibido trescientos veintitrés,ingreso
beca he percibido setecientos setenta y siete con sesenta y nueve euros por una,ingreso
me han transferido,ingreso
sofá ingresé quinientos euros de la venta del,ingreso
se me ingresaro alrededor,ingreso
me ingresaron tres,ingreso
y cinco euros por el veterinario en abril aboné noventa,gasto
de una apuesta,ingreso
me gasté cuatro,gasto
salario se me ingresaron alrededor de doscientos cincuenta y cuatro euros de,ingreso
dos mil dos euros de pensión de viudedad me entraron,ingreso
apuesta ganada ayer,ingreso
semana en impuestos,gasto
euros en gasolina,gasto
cobré tres mil,ingreso
me pagaro dos mil,ingreso
me cobraron novecientos,gasto
me pagaron dos mil,ingreso
trescientos cincuenta y cinco con sesenta y tres euros en un vuelo he desembolsado,gasto
percibí mil trescientos cuarenta,ingreso
mil quinientos veinte euros ayer en aire acondicionado gasté dos,gasto
de uno me intereses y euros pagaron,ingreso
fueron se una me en euros médica consulta,gasto
mil quinientos sesenta y cuatro euros por la suscripción al periódico este trimestre pagamos dos,gasto
me entraro aproximadamente doscientos ochenta y cuatro con treinta y seis euros por una asesoría,ingreso
me pagaron mil novecientos,ingreso
de una beca,ingreso
finde me costó seiscientos noventa y cinco euros de una escapada de fin de semana durante el,gasto
de mis euros y acciones recibí cinco de ochenta,ingreso
venta me ingresaron mil ochenta y tres con dos euros de una,ingreso
semana me entraron noventa y cinco euros de la devolución del seguro esta,ingreso
he pagado dos mil,gasto
mes me han transferido cuatro mil seiscientos sesenta y siete euros de pensión este,ingreso
y cuatro un pagar sesenta vuelo en esta euros cuatro ciento mil me tocó,gasto
gasolina he pagado tres mil ciento treinta con setenta y seis euros en,gasto
me han cobrado,gasto
he soltado tres mil ciento treinta con setenta y seis euros en gasolina,gasto
cuatrocientos devolución euros me del dieciséis de fin ingresaron la seguro,ingreso
se me fueron,gasto
cuarenta y cinco euros por vender el móvil viejo recientemente obtuve trescientos,ingreso
cuatro mil ochocientos ochenta y cuatro euros por vender el ordenador de mesa esta semana me pagaron,ingreso
me han abonado cuatro,ingreso
euros dos la he ganado switch he que por,ingreso
euros por mes de encargo este cuarenta pagaron cincuenta un y cuatrocientos me y seis mil con programación,ingreso
herencia me ingresaron cuatro mil doscientos setenta con noventa y nueve euros de una,ingreso
recibí mil cuatrocientos euros de pensión este mes,ingreso
diseño por fin,ingreso
obtuve aproximadamente mil,ingreso
por de final de diecinueve ingreso de un euros al hicieron regalo trescientos cumpleaños me,ingreso
he percibido cuatro,ingreso
y con uno y siete por proyecto ingresé treinta noventa euros mil dos trescientos,ingreso
me han pagado cuatrocientos cincuenta y uno con diez euros de una encuesta remunerada,ingreso
este pagaron con de euros y cuatro me seis por cuarenta cincuenta encargo un mes cuatrocientos programación mil,ingreso
por una reforma he soltado en total sesenta y nueve euros,gasto
me gasté dos mil seiscientos cincuenta y ocho con noventa y dos euros en gasolina,gasto
me han ingresado,ingreso
se me fueron,gasto
por una reparación,gasto
hogar tres euros del desembolsado con el mes mil doscientos seguro cuarenta este,gasto
he pagado novecientos cincuenta euros de alquiler este mes,gasto
he cobrado doscientos,ingreso
he percibido cuatro mil cuatrocientos ochenta y uno euros por un proyecto,ingreso
poco me cobraron quinientos noventa y nueve con dos euros por el mantenimiento de la cuenta hace,gasto
he soltado en total,gasto
ochenta y el proyecto euros por freelance cuatro ingresaron,ingreso
cincuenta y tres euros de impuestos anoche invertí ochocientos,gasto
se me fueron setenta,gasto
euros en diésel me cobraro mil seiscientos con veintiocho,gasto
he desembolsado seiscientos,gasto
me pagaron cuatro mil cuatrocientos cincuenta y seis con cincuenta y nueve euros por una ayuda,ingreso
de canguro recientemente recibí cuatrocientos noventa y tres con cuarenta y nueve euros por hacer,ingreso
ochocientos pagué trimestrales impuestos de,gasto
una euros transferencia cincuenta por ocho y mil cuatro pagaron,ingreso
en total ochenta y nueve euros de la venta de libros usados he recibido,ingreso
coche he cobrado cinco mil euros por vender el,ingreso
en un taxi solté ciento ochenta euros,gasto
mil ciento treinta y uno euros de un proyecto me ingresaron,ingreso
euros en gasolina he soltado tres mil ciento treinta con setenta y seis,gasto
han seguro recibo pasado del de ciento el veinte euros,gasto
bancaria anoche y ocho euros una cincuenta con y aboné doscientos mil de treinta uno,gasto
en compra seiscientos euros la desembolsado he,gasto
por un bonus he percibido dos mil ochocientos cuarenta y dos euros,ingreso
invertí concierto treinta esta semana novecientos en euros,gasto
me han soltado al final ochocientos ochenta y ocho con cuarenta y dos euros por el proyecto freelance por fin,ingreso
setenta y cinco con treinta y siete euros de la cuota del club esta mañana invertí trescientos,gasto
este por de dos euros mes programación encargo percibí treinta un,ingreso
recibí trescientos treinta,ingreso
cobré cuatro mil,ingreso
mes me entraron ochenta y nueve euros de ayuda escolar este,ingreso
me costó tres mil ochocientos ochenta y ocho con noventa y siete euros el coche,gasto
me diecisiete euros una con de abonado ciento han transferencia,ingreso
por una herencia he percibido setecientos cinco con tres euros,ingreso
me pagaron mil quinientos noventa y nueve con cincuenta y uno euros por una beca,ingreso
gasté cuarenta y cinco,gasto
me abonó sesenta,ingreso
euros por con cincuenta cuatro seis pagaron treinta tres mil una y ayuda y,ingreso
un bizum a ana de veinte euros para la cena le hice,gasto
y de una treinta setenta ocho trescientos devolución me con y ingresaron euros,ingreso
he desembolsado cuatro,gasto
en un concierto aboné seiscientos sesenta y uno euros este mes,gasto
me gasté tres mil quinientos ochenta y uno con sesenta y seis euros en netflix,gasto
he percibido veintiocho euros por hacer fotos en una boda recientemente,ingreso
alquiler cuatro setecientos cincuenta el setenta cuatro por y euros cuatro con mil pagué,gasto
cobré dos mil ciento cuarenta y uno con ochenta y cuatro euros por un bonus,ingreso
trescientos y treinta taxi fueron un uno en me hace se días nueve unos con,gasto
he ingresado mil doscientos,ingreso
dos mil noventa euros por un proyecto me pagaron,ingreso
luz he gastado cincuenta y siete con treinta y siete euros por la factura de la,gasto
recibí mil quinientos,ingreso
entraron casi ciento sesenta y cuatro euros de salario bruto por fin,ingreso
he recibido ciento,ingreso
euros de nómina he recibido setenta y siete,ingreso
novecientos una cuatro y me euros noventa mil por venta pagaron,ingreso
han tres siete y portátil en cincuenta doscientos cargado un me ayer mil,gasto
de para febrero veinte el en me tocó gato arena pagar,gasto
me de mi parte abonado las parcelas,ingreso
veintiuno gasté euros con y mil tres me setenta siete en reparación una,gasto
me gasté dos,gasto
ingresé mil cuatrocientos,ingreso
cuatro cayó una por deuda fin de pendiente alrededor mil por cinco me,ingreso
doscientos diecisiete con cincuenta y cuatro euros de un bonus recibí mil,ingreso
entraro quinientos cincuenta y seis euros por dar clases particulares anoche,ingreso
aboné treinta euros con una batería del coche este mes,gasto
el mes pasado,gasto
aboné quinientos cuarenta con setenta y ocho euros por la suscripción al periódico,gasto
y una ingresé por euros siete ochenta,ingreso
fueron noventa euros en el veterinario se me,gasto
gas me tocó pagar cuatrocientos veintiséis euros ayer en la factura del,gasto
tres mil dieciocho euros en ropa he desembolsado,gasto
me entraro cuatrocientos sesenta y cuatro con cincuenta y cuatro euros por horas extra,ingreso
me ingresaron mil ochocientos,ingreso
me han abonado cuatro,ingreso
recibí cuatrocientos noventa,ingreso
me han abonado dos,ingreso
mil ciento doce euros de una herencia recibí tres,ingreso
me gasté setecientos,gasto
un trabajo freelance,ingreso
semana cobré treinta con sesenta y seis euros de una bonificación esta,ingreso
por con y mil cuatro una veintidós cobré cinco euros devolución seiscientos,ingreso
japonés pagué noventa euros de cena en un,gasto
gasté cuarenta euros en,gasto
me gasté cuatro mil ochocientos cinco con trece euros en gasolina,gasto
me cobraron cuatro,gasto
cuatro cuarenta y trescientos nueve por mil pagué compra euros,gasto
me pagaron noventa y,ingreso
gasté ciento setenta,gasto
proyecto me han abonado dos mil cuatrocientos dieciocho con setenta y tres euros de un,ingreso
ingresé dos mil setecientos,ingreso
apuesta me pagaron ochocientos ochenta y dos con diez euros por una,ingreso
ingreso por cumpleaños final fin hicieron regalo euros de trescientos al de un de me,ingreso
ochenta para gastado tres el euros pagar cerrajero novecientos he,gasto
recibí cuatro mil doscientos once euros de salario hace poco,ingreso
coche me gasté cuatro mil quinientos treinta y tres con sesenta y uno euros en el,gasto
pendiente esta semana,ingreso
suscripción al periódico aboné quinientos cuarenta con setenta y ocho euros por la,gasto
flores en febrero he desembolsado tres mil cuatrocientos cincuenta y cinco euros con,gasto
acondicionado se me fueron trescientos cincuenta y siete euros en aire,gasto
me abonó novecientos,ingreso
he soltado cuatrocientos setenta y siete con sesenta y cuatro euros en gasolina,gasto
cobré alrededor de,ingreso
por una beca,ingreso
cayó sesenta cuatro ocho de wallapop euros recientemente en venta una me mil,ingreso
de una venta,ingreso
me ingresaron ochocientos,ingreso
treinta por con total veinticuatro un traducir documento en ingresé ochocientos,ingreso
me costó dos mil,gasto
coche este mes,gasto
he ingresado trescientos,ingreso
he pagado cuatrocientos setenta,gasto
cobré doscientos catorce con,ingreso
no pude usar,ingreso
compra he desembolsado dos mil seiscientos ochenta y cinco con veintisiete euros en la,gasto
ingresé tres mil ochocientos cincuenta y cuatro euros por una venta,ingreso
me han pagado ciento cincuenta euros por el curso online que vendí,ingreso
irpf me pagaron novecientos sesenta y cuatro euros de la devolución del,ingreso
cincuenta cuatrocientos cuatro mil ocho cobré y apuesta por con una treinta,ingreso
he ingresado cincuenta,ingreso
me han mandado ciento ochenta euros por el bizum de la cena,ingreso
me han soltado doscientos veintinueve con sesenta y seis euros de nómina esta semana,ingreso
en el alquiler,gasto
me ingresaro mil quinientos,ingreso
de indemnización laboral me cayó unos trescientos trece con veintiséis euros,ingreso
cincuenta y factura con agua cobraron la euros me pagar novecientos del para veinte nueve,gasto
me ingresaro mil cincuenta y cinco con veintiséis euros de una venta,ingreso
euros electricista doscientos el han uno mes este en y cuarenta cargado,gasto
he desembolsado cuatro,gasto
ayer en veintiuno costó cine me,gasto
en la cena,gasto
me cayeron mil quince,ingreso
de estudios hoy,ingreso
fueron comisión bancaria en me euros siete mes este setecientos se y una,gasto
me ingresaron tres mil ochocientos sesenta y nueve con cincuenta y ocho euros de una beca,ingreso
me han abonado cuatro,ingreso
por una apuesta me cayeron cuatro mil trescientos treinta y uno euros,ingreso
ochenta de aboné una euros doscientos mil cena y,gasto
siete euros netflix me costó dos mil cincuenta y seis con noventa y,gasto
gasté veinticinco euros en,gasto
pedro me han pagado los doscientos euros que me debía,ingreso
transferencia una tres cobré ochocientos dos mil euros,ingreso
de una beca,ingreso
trimestral ingresé al final mil ciento noventa y siete euros de bonus,ingreso
venta recibí cuatro mil novecientos veinticuatro con setenta y uno euros de una,ingreso
devolución de hacienda,ingreso
cuatro mil setecientos sesenta y tres con cincuenta y nueve euros de una venta me ingresaron,ingreso
suscripción se me fueron cuatro mil quinientos ochenta y seis euros en una,gasto
en unas fotos,ingreso
ayuda municipal recientemente he cobrado mil doscientos sesenta y ocho euros de una,ingreso
trimestre me hicieron un ingreso de dos mil seiscientos noventa y uno euros de la prestación por desempleo este,ingreso
me costó dos,gasto
se me ingresaron setecientos,ingreso
trabajo de diseño,ingreso
me han pagado,ingreso
venta ingresé mil doscientos cuarenta y cuatro con sesenta y tres euros por una,ingreso
euros en electricidad me gasté cuatro mil ciento cincuenta y seis con noventa y uno,gasto
pagamos ciento cuarenta,gasto
en la compra,gasto
cobré ochenta y,ingreso
veintidós euros por dar clases particulares en febrero me pagaron,ingreso
piso me entraron doscientos euros de alquiler del,ingreso
he pagado seiscientos cincuenta y cinco con veinticuatro euros ayer en comida para el perro,gasto
euros escolar ayuda se me de setenta ingresaron,ingreso
medicamentos euros dos de alrededor han y cargado sesenta en,gasto
euros en ropa,gasto
mes mil pensión euros este recibí de,ingreso
en el mercadillo gasté veinticinco euros,gasto
he pagado cuatro mil ciento nueve con setenta y cinco euros en una reparación,gasto
me cayó cuatro mil sesenta y ocho euros de una venta en wallapop recientemente,ingreso
recibí cuatro mil,ingreso
me pagaron cuatro mil treinta y seis con cincuenta y tres euros por una ayuda,ingreso
euros en electricidad he pagado cuatrocientos sesenta y cuatro,gasto
suscripción me gasté novecientos cincuenta con setenta y cuatro euros en una,gasto
me pagaro seiscientos cincuenta y cinco euros por una beca,ingreso
transferido mil ciento setenta y ocho euros de la venta de libros usados me han,ingreso
cuatrocientos cincuenta euros de cuota de gimnasio anual he abonado,gasto
euros en ropa he pagado dos mil cuatrocientos sesenta y seis,gasto
he ingresado tres mil setenta y cinco euros por una apuesta ganada este mes,ingreso
me llegó un,ingreso
me entraro dieciocho con,ingreso
solté sesenta y,gasto
dos mil sesenta y cinco con cincuenta y dos euros el coche me costó,gasto
me euros y setenta cuatro mil tres proyecto por un,ingreso
un ingresé ciento con euros proyecto treinta y dieciocho por,ingreso
seis el mil con pagué cincuenta nueve y por supermercado,gasto
por un bonus,ingreso
poco se me fueron novecientos veintiuno euros con zapatos hace,gasto
me cobró cincuenta,gasto
he pagado dos,gasto
