oracion,etiqueta
finde diecinueve pagué euros el diésel de,gasto
en la compra he soltado mil quinientos cincuenta y tres con veintiséis euros,gasto
cobré con cuatro ochenta euros uno cuarenta un y bonus mil dos por y,ingreso
cobré tres mil doscientos,ingreso
he percibido cuatro mil,ingreso
mil doscientos veintiocho con cincuenta y dos euros por un bonus cobré cuatro,ingreso
se me fueron,gasto
me pagaron cuatro,ingreso
invertí mil treinta,gasto
cuatro mil quinientos treinta y tres con sesenta y uno euros en el coche me gasté,gasto
familiar he percibido cuatro mil doscientos sesenta y cuatro euros de una transferencia,ingreso
por una devolución,ingreso
solté mil quinientos treinta y tres con cincuenta y dos euros en un desayuno en enero,gasto
devolución y novecientos pagaron irpf me euros del la de cuatro,ingreso
cincuenta el supermercado tres en euros y dos cincuenta ocho setecientos desembolsado con y mil,gasto
familiar esta semana,ingreso
recibí noventa y cinco,ingreso
en temporada trescientos euros ropa de,gasto
y setecientos seis sesenta euros apuesta me con nueve noventa pagaron por una,ingreso
corte cuarenta gasté inglés cinco y en el,gasto
aboné ciento noventa,gasto
he pagado mil trescientos,gasto
una transferencia familiar,ingreso
el mes pasado,ingreso
me cobraron cincuenta,gasto
cobré cuatro mil doscientos,ingreso
premio mil y de un cincuenta quinientos concurso euros cuatro ayer dos he percibido,ingreso
final por el trabajo de diseño mil al percibido euros,ingreso
aboné noventa y ocho euros este mes en medicamentos,gasto
he pagado cuatrocientos treinta y tres con veintiocho euros en la compra,gasto
devolución de amazon,ingreso
semana este trimestre,gasto
por una beca me cayeron seiscientos cincuenta y cinco euros,ingreso
euros ciento recibí una con setenta setenta transferencia mil,ingreso
me cobraron tres mil,gasto
he pagado dos,gasto
apuesta ochocientos tres veintisiete una euros ingresé por,ingreso
me abonó veinticinco,ingreso
pagar unos auriculares tuve que pagar cincuenta y siete euros para,gasto
en el gimnasio,gasto
ayer y cincuenta uno nómina percibí doscientos de,ingreso
cine he desembolsado seiscientos veinticuatro euros esta semana en,gasto
durante seiscientos se fueron el me euros aparcamiento con diez,gasto
tres de cincuenta nueve y una me mil ochocientos ingresaron euros beca con ocho sesenta,ingreso
hace unos días se me fueron trescientos uno con treinta y nueve euros en un taxi,gasto
para pagar parking desembolsé dos mil uno con sesenta y ocho euros,gasto
mil cuatrocientos cincuenta y ocho con sesenta euros por nómina ingresé tres,ingreso
me ingresaron novecientos,ingreso
mudanza más noventa doscientos setenta euros en y me menos y siete o con cobraron una,gasto
de una compra,ingreso
de una transferencia,ingreso
me suscripción mil seis fueron en y una euros se cuatro quinientos,gasto
percibido cinco cuarenta trabajo euros y doscientos siete con un por y freelance cuatro setenta he,ingreso
se fueron trescientos diecisiete,gasto
de quinientos setenta y uno euros por cine invertí alrededor,gasto
me entraron doscientos euros de alquiler del piso,ingreso
quinientos diecinueve con veinte euros de netflix aboné mil,gasto
pagué ciento veinte,gasto
he pagado setecientos veintisiete,gasto
mil ochocientos cuatro con cuarenta y seis euros por hacer de canguro este mes me cayó,ingreso
se me ingresaron novecientos veinticinco euros por una asesoría recientemente,ingreso
para veinticuatro euros pagado cinco y comida ayer he cincuenta perro el en seiscientos,gasto
mil ciento ocho euros de una devolución de hacienda el mes pasado obtuve dos,ingreso
invertí quinientos en cuatro dos euros mil tren ayer,gasto
de desarrollo web me abonó alrededor de mil ochocientos catorce con setenta y dos euros por un proyecto,ingreso
un ingreso de doscientos treinta y nueve con veinticinco euros por alquilar una habitación ayer me hicieron,ingreso
he percibido tres mil novecientos uno euros por una apuesta,ingreso
me entraron cuatrocientos treinta y cuatro euros de ayuda escolar,ingreso
he percibido mil ciento uno con ochenta y ocho euros por un bonus,ingreso
curso euros online me de cuatrocientos el costó,gasto
dos ocho de me y euros nueve transferencia novecientos y una mil cuarenta cuarenta han abonado,ingreso
en una reparación,gasto
gaste doscientos en gasolina,gasto
me abonó setecientos setenta,ingreso
cobré cuatro mil cuatrocientos,ingreso
me han transferido trescientos,ingreso
el mes pasado,ingreso
se me ingresaro doscientos,ingreso
me cobraro ochocientos noventa,gasto
euros en ropa he soltado novecientos cuarenta y cuatro con noventa y siete,gasto
me tocó pagar,gasto
cobré cuatro mil,ingreso
concurso ingresé cincuenta y nueve euros de un premio de,ingreso
he percibido cuatro,ingreso
ingresé mil doscientos,ingreso
apuesta me pagaron setecientos noventa y nueve con sesenta y seis euros por una,ingreso
spotify este mes,gasto
de un bonus,ingreso
tío de mi la euros me tres herencia de cayeron,ingreso
he doscientos euros cobrado hoy y treinta treinta siete de nueve intereses con,ingreso
un trabajo freelance me pagaron tres mil setecientos tres con veintiuno euros por,ingreso
gasté tejado el en reparar ayer trescientos euros,gasto
gasolina euros novecientos veintidós cobraron en,gasto
mil ciento veinticinco con diecinueve euros por un vuelo pagué tres,gasto
material de oficina,gasto
por una impresora he gastado más o menos doscientos noventa y dos euros,gasto
me cinco el con en veintitrés sesenta gasté ochocientos euros dentista,gasto
me cobraron aproximadamente quinientos cincuenta y seis euros por la peluquería,gasto
el mes pasado,ingreso
en la compra,gasto
laboral recibí dos mil ochocientos euros de indemnización,ingreso
pasada solté ochenta y siete euros en el ibi la semana,gasto
me han transferido,ingreso
en una cena,gasto
noventa mil ingresé y nómina con dos euros por doce tres,ingreso
netflix pagué cuarenta y ocho con setenta y ocho euros por,gasto
un cincuenta mes costó en y euros cinco me este,gasto
seiscientos sesenta y cuatro euros por el ibi hoy he pagado,gasto
trimestre he tenido que abonar doscientos ochenta y cuatro euros por unas gafas nuevas este,gasto
euros cuatro seis uno con un de recibí cincuenta y y mil proyecto cincuenta,ingreso
me han transferido cuatrocientos,ingreso
pagué tres mil doscientos,gasto
y noventa ochenta pagaron nueve trescientos por bonus euros con me un y,ingreso
se me ingresaron,ingreso
mil novecientos cinco euros de una venta en wallapop percibí tres,ingreso
solté ochocientos treinta,gasto
me ingresaro ochenta y,ingreso
me han pasado dieciocho,gasto
me han pagado,ingreso
me cayeron cuatro mil trescientos setenta y nueve con quince euros por un bonus,ingreso
pasado sesenta y cinco euros de spotify familiar me han,gasto
he soltado ochenta y nueve euros esta semana en el taller del coche,gasto
he pagado novecientos,gasto
me pagaron cuatro mil novecientos noventa y cuatro euros por una venta,ingreso
por el supermercado pagué tres mil doscientos treinta euros,gasto
y con de seiscientos dos cuatro y supermercado el mil euros tres aboné ochenta,gasto
recientemente me han transferido ciento diecinueve con cincuenta y tres euros de una devolución de hacienda,ingreso
pagar la farmacia,gasto
me cobraron tres,gasto
recibí cuatro mil,ingreso
seiscientos veinticuatro con nueve euros en netflix me gasté,gasto
he desembolsado mil cuatrocientos ochenta y tres con veinte euros en el alquiler,gasto
el mes pasado me entraron setenta y cinco euros de una devolución de hacienda,ingreso
verano me han abonado trescientos cincuenta euros de la extra de,ingreso
he abonado mil,gasto
pagué mil novecientos cuarenta y nueve con treinta y uno euros por el dentista,gasto
treinta mil euros alquiler cobraron novecientos tres me en dieciocho el,gasto
desembolsé doscientos sesenta con,gasto
euros y el ocho y seiscientos he siete treinta con en desembolsado cuarenta mil,gasto
trabajo de diseño he percibido al final mil euros por el,ingreso
nueve freelance por y con dos cuatrocientos trabajo cuarenta euros pagaron cinco mil me,ingreso
en la compra,gasto
en una suscripción he pagado cuatro mil quinientos treinta y cuatro con ochenta y uno euros,gasto
pagué cincuenta y,gasto
de una suscripción aboné trescientos quince con cincuenta y tres euros,gasto
en mil fin por he ocho de una ingresado wallapop veintitrés con treinta y euros dos,ingreso
me pagaro dos mil cuatrocientos cuarenta y cinco con nueve euros por un trabajo freelance,ingreso
se me fueron,gasto
fueron doscientos treinta y tres con setenta y seis euros en electricidad se me,gasto
mes ochenta doscientos euros vacacional alquiler del ingresé siete el y,ingreso
mil gasté un en sesenta me quinientos vuelo euros,gasto
desembolsé en este seis y con cuatro medicamentos mes euros ochocientos,gasto
mil y euros regalo de obtuve cinco hoy treinta de cumpleaños,ingreso
cumpleaños por fin,ingreso
ayer me hicieron un ingreso de quinientos sesenta y seis euros por vender entradas,ingreso
he cobrado mil doscientos sesenta y ocho euros de una ayuda municipal recientemente,ingreso
mil noventa y cuatro con ocho euros de una devolución de una compra me pagaron,ingreso
de la tarjeta he cobrado treinta y uno con ochenta y seis euros de cashback,ingreso
cuota del autónomo he tenido que abonar mil novecientos treinta con dos euros este mes en la,gasto
gasté quinientos euros en,gasto
doscientos noventa y cinco con cuarenta y seis euros el gimnasio me costó,gasto
euros por nómina me cayeron dos mil seiscientos cuarenta y ocho con cincuenta y dos,ingreso
me llegaron seiscientos,ingreso
veintiocho me euros cuatrocientos la transferido de beca de hoy han,ingreso
percibí sesenta y siete euros por referir a un cliente,ingreso
me costó cuatrocientos euros,gasto
curso por fin he percibido doscientos sesenta y uno con treinta euros por impartir un,ingreso
aboné cuatro mil cuarenta,gasto
spotify me han cobrado trescientos euros del,gasto
mil doscientos euros de bonus trimestral me abonaron,ingreso
he percibido cuatro mil novecientos sesenta y nueve con ochenta y dos euros por un proyecto,ingreso
me cobraron cincuenta,gasto
de me una y cuatro de cuatrocientos mil tres euros herencia alrededor abonaron,ingreso
en el alquiler me cobraron setecientos veinte euros,gasto
se me fueron tres,gasto
me cobraron mil,gasto
cuatro mil diez con veintidós euros en el alquiler he pagado,gasto
niñera este mes me costó cincuenta y dos con cincuenta y cinco euros de la,gasto
de un bonus,ingreso
trescientos cobré euros noventa por trabajo dos freelance mil,ingreso
supermercado aboné setecientos sesenta y nueve con once euros de el,gasto
percibí treinta y,ingreso
he ingresado doscientos tres,ingreso
me cobraron cuatro mil,gasto
se me fueron tres mil trescientos diecinueve con dieciséis euros en un vuelo,gasto
publicado por fin he recibido cincuenta y nueve con cincuenta y siete euros por un artículo,ingreso
tres con y euros tres por semana mil trescientos comunidad ochenta esta pagado y noventa la,gasto
se me fueron noventa euros en el veterinario,gasto
quincena he cobrado mil novecientos euros esta,ingreso
pasada me entraron mil quinientos cuarenta y seis euros por vender el móvil viejo la semana,ingreso
ibi pagué en total trescientos sesenta y cinco con cincuenta y nueve euros por el,gasto
por una transferencia me pagaron tres mil ochocientos uno con treinta y cuatro euros,ingreso
en el supermercado,gasto
me pagaron cien,ingreso
me han cobrado,gasto
vinted esta semana se me ingresaro cuatro mil doscientos treinta y siete euros de una venta en,ingreso
me han pagado,ingreso
me ingresaron dos mil uno con dieciocho euros de nómina,ingreso
pagué ochocientos euros de impuestos trimestrales,gasto
gimnasio he desembolsado trescientos cincuenta y ocho con cuarenta y tres euros en el,gasto
he ingresado ciento sesenta y cinco con siete euros por un encargo de programación esta semana,ingreso
me costó dos,gasto
en uno desembolsado he la seiscientos compra,gasto
trescientos y costó me electricidad veintisiete euros cuatro con,gasto
han la cincuenta día del y el me devolución transferido irpf euros dos de otro tres,ingreso
de nómina ayer,ingreso
he percibido mil novecientos veintiuno con sesenta euros por una apuesta,ingreso
nevera el viernes,gasto
solté seiscientos setenta,gasto
de una apuesta,ingreso
en medicamentos recetados gasté ciento diez euros,gasto
gimnasio me gasté mil novecientos veinticuatro con treinta y dos euros en el,gasto
de la luz he soltado mil trescientos veintiséis con cuarenta y uno euros este mes en la factura,gasto
consultoría esta semana me entraro nueve euros por trabajo de,ingreso
me han abonado dos,ingreso
me pagaro cuatro mil,ingreso
me pagaron tres mil,ingreso
he desembolsado tres mil ciento treinta y tres con treinta y cuatro euros en electricidad,gasto
un tres euros ciento ochenta por cobré con proyecto mil,ingreso
en doce mil noventa euros me fueron y netflix quinientos con se,gasto
con seis seis mil ingresé un ochocientos cuarenta trabajo por y setenta freelance y,ingreso
acabé pagando dos mil setecientos cuarenta y siete euros con un regalo recientemente,gasto
se me fueron trescientos,gasto
me pagaron dos,ingreso
por una ayuda he percibido ciento tres euros,ingreso
cuenta la en euros metido novecientos de beca han,ingreso
me pagaro setecientos noventa,ingreso
quinientos seis me cobraron la peluquería aproximadamente euros por y,gasto
aboné ciento noventa,gasto
diésel en febrero pagué dos mil setecientos treinta y seis euros de,gasto
la cinco en setenta enero aboné euros de niñera,gasto
diseño del logo me han pagado ochocientos euros por el,ingreso
cuatro euros abonar tenido nuevo mil este que un noventa he en siete y mes,gasto
mes cobré tres mil doscientos euros de salario bruto este,ingreso
me clavaron ochenta,gasto
me pagaro trescientos cincuenta euros por el proyecto freelance,ingreso
me han soltado dos mil trescientos setenta y tres euros de una devolución de una compra,ingreso
he pagado dos mil ciento setenta y uno con sesenta y cuatro euros en el seguro del coche recientemente,gasto
compra pagué dos mil ciento sesenta y cuatro con cuarenta y tres euros por la,gasto
electricista me han cargado doscientos cuarenta y uno euros este mes en el,gasto
recibí tres mil,ingreso
acabé pagando cuatrocientos,gasto
aproximadamente quinientos cincuenta y seis euros por la peluquería me cobraron,gasto
de una apuesta me ingresaro tres mil cuatrocientos nueve con ochenta y ocho euros,ingreso
proyecto setenta por novecientos cobré euros mil nueve un,ingreso
de una transferencia recibí mil trescientos veintidós con cuarenta y ocho euros,ingreso
cuarenta y siete con quince euros de una transferencia familiar ayer recibí cuatrocientos,ingreso
me cobraron cuatro,gasto
en la compra,gasto
quinientos ochenta y cinco con ochenta y cinco euros de un proyecto recibí mil,ingreso
le mandé cincuenta,gasto
cobré trescientos setenta y,ingreso
intereses recibí mil setecientos diecinueve euros de,ingreso
me costó novecientos,gasto
pagué tres mil,gasto
devolución ingresé dos mil setecientos quince con treinta y siete euros por una,ingreso
anual del coche me han cobrado doscientos cincuenta euros de la revisión,gasto
se me fueron tres,gasto
euros por nómina,ingreso
canguro este mes me pagaro ciento noventa euros por hacer de,ingreso
fin me cayó más o menos ciento cincuenta y nueve con sesenta y cinco euros de un premio pequeño por,ingreso
transferido han el por me cuatrocientos euros,ingreso
seguro del coche,gasto
euros abonó y setenta setecientos me este online tutorías ocho mes,ingreso
cuarenta tres euros mil ochenta me una quinientos costó suscripción,gasto
de en euros wallapop novecientos percibí venta una cinco mil,ingreso
me han abonado cuarenta,ingreso
solté diecisiete euros,gasto
seiscientos euros del seguro por el golpe me llegaron,ingreso
ropa en vinted cobré sesenta euros por vender,ingreso
coche en enero,gasto
me gasté cuatro,gasto
para la cena le transferí sesenta euros a carlos,gasto
madre mi la le doscientos para euros a compra,gasto
me entraron mil quinientos cuarenta y seis euros por vender el móvil viejo la semana pasada,ingreso
me ingresaron ochenta,ingreso
mi de cincuenta por doscientos euros cumpleaños abuelo recibí,ingreso
me tocó pagar cuatrocientos,gasto
euros en electricidad me gasté cuatro mil setecientos,gasto
alquiler este mes he soltado novecientos cincuenta euros de,gasto
ibi uno mil y invertí treinta por hace con y noventa el euros ocho,gasto
pagamos ciento treinta,gasto
recibí con una mil cuatro de y setenta seiscientos euros y uno herencia cincuenta,ingreso
el mes pasado,ingreso
freelance esta semana,ingreso
se me ingresaron mil,ingreso
indemnización laboral unos cayó euros trescientos me veintiséis trece de,ingreso
se me fueron cuatro mil quinientos noventa y dos con once euros en ropa,gasto
venta me pagaron cuatro mil cuatrocientos veintisiete con noventa y tres euros por una,ingreso
se me ingresaron dos mil treinta y tres con noventa y cuatro euros por referir a un cliente el mes pasado,ingreso
gasté mil setecientos,gasto
cena me mandaron un bizum de cincuenta euros por la,ingreso
ayer cobré tres mil setecientos dieciocho euros por el trabajo de diseño,ingreso
he ingresado novecientos,ingreso
me cobraron aproximadamente,gasto
aboné seiscientos cincuenta y,gasto
tres apuesta por ochocientos ingresé una veintisiete mil,ingreso
libros del máster,gasto
me costó dos,gasto
una asesoría hoy,ingreso
desembolsé casi seiscientos,gasto
beca he percibido tres mil trescientos ochenta y siete euros por una,ingreso
freelance me pagaron dos mil cuatrocientos cuarenta y cinco con nueve euros por un trabajo,ingreso
aboné setecientos cuarenta y,gasto
de una devolución,ingreso
entraron mil setenta y,ingreso
pagué cuatro mil seiscientos noventa y uno con veintiocho euros por el supermercado,gasto
de el gimnasio,gasto
pagado ciento setenta y dos euros de pensión hace poco me han,ingreso
de euros recibido he y siete nómina,ingreso
dividendos por fin,ingreso
se me fueron,gasto
pagado doscientos de un bono hoy seis han me euros y fidelidad cincuenta,ingreso
euros quinientos entradas vender por entraron hoy me,ingreso
euros el coche me costó ochocientos setenta y uno con setenta y siete,gasto
cobré tres mil,ingreso
cincuenta fundi comida me en,gasto
por una devolución cobré cuatro mil cuatrocientos cuarenta y dos con veintiséis euros,ingreso
me gasté tres,gasto
ingresé noventa y cinco euros por vender entradas que no pude usar,ingreso
abonado mil ochocientos noventa y nueve con setenta y nueve euros de una transferencia me han,ingreso
obtuve quinientos treinta y dos con dieciséis euros de una encuesta remunerada este mes,ingreso
pagué dos mil setecientos,gasto
bici esta semana me pagaron noventa y nueve euros por vender una,ingreso
un ochenta y tren doscientos en euros ayer siete fueron con trece,gasto
mil novecientos ochenta y dos con cincuenta y seis euros de una transferencia familiar obtuve aproximadamente,ingreso
me han cargado,gasto
euros por una nueve venta con he percibido,ingreso
reclamación al banco,ingreso
vídeo he ingresado novecientos treinta y nueve euros por editar un,ingreso
de una herencia me han abonado cuatro mil setecientos sesenta y uno con treinta y nueve euros,ingreso
recetados gasté ciento diez euros en medicamentos,gasto
por una devolución,ingreso
en una reparación me cobraro cuatrocientos noventa y seis con treinta y cuatro euros,gasto
euros de hacienda,ingreso
lunes me han transferido trescientos cuarenta y siete con ochenta euros de comisión por ventas el,ingreso
euros por nómina cobré cuatro mil setecientos cincuenta y ocho con cuarenta y cuatro,ingreso
una encuesta remunerada me han soltado cuatrocientos cincuenta y uno con diez euros de,ingreso
en una cena,gasto
he pagado tres,gasto
euros una vender novecientos por cincuenta esta recibí semana bici y,ingreso
una asesoría hoy,ingreso
fueron trescientos cuarenta y dos con setenta y cinco euros para pagar el súper se me,gasto
recibí euros uno noventa seiscientos y de,ingreso
en la cena,gasto
quinientos veinte euros por un trabajo freelance me pagaron,ingreso
se fueron dos,gasto
ganada este mes,ingreso
por una herencia,ingreso
seiscientos doce con ochenta y tres euros para pagar un vuelo he gastado,gasto
me hicieron un,ingreso
un trabajo freelance recibí cuatro mil quinientos cuarenta con treinta y ocho euros de,ingreso
en la comunidad gasté ciento tres con cinco euros esta semana,gasto
freelance me pagaron ciento setenta y seis con ochenta y seis euros por un trabajo,ingreso
en aire acondicionado acabé pagando quinientos cincuenta y nueve euros esta semana,gasto
en una suscripción,gasto
veinticuatro euros electricidad me costó tres mil quinientos ochenta y ocho con,gasto
ingresé ochenta y siete,ingreso
electricidad he pagado dos mil seiscientos treinta y siete con noventa y cinco euros en,gasto
ciento anoche he cuatro ocho percibido euros y mil de con salario,ingreso
intereses ochenta ochocientos me marzo euros de cuatro abonaron en cuatro y,ingreso
por la avería me cobró cincuenta y cinco euros el fontanero,gasto
transferido trescientos euros por la deuda pendiente me han,ingreso
mes en ropa,gasto
aboné cuatro mil,gasto
me han transferido,ingreso
la por han euros pendiente deuda transferido me,ingreso
desembolsé tres mil,gasto
pague trescientos,gasto
recibí tres mil quinientos euros de la venta del coche viejo,ingreso
intereses este mes,ingreso
euros en ropa me cobraro cuatro mil setecientos cincuenta con veintisiete,gasto
treinta y uno con ochenta y seis euros de cashback de la tarjeta he cobrado,ingreso
dinero quitaron me,gasto
mil trescientos treinta y uno con noventa y siete euros por un proyecto ingresé dos,ingreso
ingresé tres mil cuatrocientos setenta y siete con sesenta y tres euros por una venta,ingreso
en una reparación he pagado dos mil cuatrocientos ochenta y nueve con treinta y dos euros,gasto
me cobraro cincuenta y,gasto
se me ingresaron,ingreso
me cobraron mil,gasto
euros en gasolina me cobraro cuatro mil ciento ochenta con diez,gasto
un trabajo freelance cobré tres mil trescientos treinta y seis euros por,ingreso
el coche hoy me hicieron un ingreso de ochenta y uno con sesenta y dos euros por vender,ingreso
percibido seiscientos por y mil una he deuda euros nueve pendiente,ingreso
tres mil cuarenta y seis euros por nómina he percibido,ingreso
esta fueron quinientos dentista el se euros cincuenta seis semana y,gasto
anoche con euros uno y netflix cuarenta me,gasto
mil cuatrocientos cincuenta y cuatro con ochenta y cuatro euros de una cena aboné cuatro,gasto
el que me curso pagado setenta novecientos por impartí euros,ingreso
cinco pagué cincuenta ciento y euros con el alquiler por,gasto
pagué seiscientos euros de vuelos para navidad,gasto
y nueve euros de un premio de concurso ingresé cincuenta,ingreso
y proyecto un uno he mil percibido cuatro cuatrocientos euros por,ingreso
me costó dos mil,gasto
y euros gasté con suscripción me mil dos cincuenta una tres en siete,gasto
he percibido mil,ingreso
euros el coche,gasto
trescientos veintidós con cuarenta y ocho euros de una transferencia recibí mil,ingreso
euros recientemente de obtuve un dos de fidelidad con bono sesenta cuatrocientos cuatro,ingreso
me costó cuatrocientos,gasto
he ingresado mil,ingreso
recibo del colegio me han pasado setecientos euros del,gasto
doscientos entradas vender euros me hoy y tres ingreso cuarenta por hicieron un,ingreso
he desembolsado dos,gasto
una habitación ayer me hicieron un ingreso de doscientos treinta y nueve con veinticinco euros por alquilar,ingreso
novecientos cincuenta euros de alquiler este mes he pagado,gasto
vuelo se me fueron mil ciento treinta y dos con setenta y ocho euros en un,gasto
compra me gasté cuatro mil veintiséis con noventa y nueve euros en la,gasto
aboné seiscientos cincuenta,gasto
apuesta ganada hoy,ingreso
alquiler he pagado cuatro mil novecientos ochenta y uno con cincuenta y cinco euros en el,gasto
he cobrado doscientos,ingreso
novecientos uno euros por vender una bici me entraron,ingreso
una mil transferencia ochocientos dos cobré tres euros,ingreso
cuarenta y intereses euros cayó me de hoy,ingreso
cobré cincuenta y,ingreso
cien pagado he,gasto
peluquería me cobraron aproximadamente quinientos cincuenta y seis euros por la,gasto
concierto cuarenta pagué euros por al la,gasto
para pagar ropa tuve que pagar ochenta y tres euros,gasto
una consulta médica me tocó pagar mil seiscientos cuarenta y siete con veintidós euros ayer en,gasto
devolución recibí treinta y dos con sesenta euros de una,ingreso
he percibido cuatro,ingreso
me cayeron mil treinta,ingreso
me costó dos mil ochocientos veinticinco euros la compra,gasto
obtuve trescientos cincuenta,ingreso
me han abonado,ingreso
pagar la hipoteca solté dos mil quinientos diez euros para,gasto
recientemente he desembolsado novecientos veintiocho euros por un móvil nuevo,gasto
desempleo este trimestre,ingreso
me ingresaron euros dos ochenta y treinta siete herencia de quinientos mil dos y una,ingreso
pagué trece euros,gasto
nueve transferencia una euros quinientos dos sesenta con setenta mil y por y ingresé,ingreso
electricista he tenido que abonar aproximadamente ciento cuarenta euros por el,gasto
coche pagué tres mil cuatrocientos noventa y tres con treinta y nueve euros por el,gasto
mil cuatrocientos sesenta y seis con noventa y siete euros de una suscripción aboné dos,gasto
de con bonus un mil veinticuatro y quinientos euros tres me dos ingresaron,ingreso
recibí cuatro mil,ingreso
de una bonificación,ingreso
me quitaron cien,gasto
me han transferido trescientos euros por la deuda pendiente,ingreso
entraron dos mil trescientos,ingreso
aboné ciento treinta,gasto
