oracion,etiqueta
he percibido tres mil trescientos ochenta y siete euros por una beca,ingreso
me cayó mil doscientos treinta y nueve con trece euros de una beca transporte esta semana,ingreso
me tocó pagar,gasto
mil cuarenta con diez euros de ropa aboné cuatro,gasto
se me ingresaro cuatrocientos veinte con sesenta y seis euros de una venta en wallapop el lunes,ingreso
por una venta,ingreso
electricidad me gasté dos mil seiscientos catorce euros en,gasto
y uno y cincuenta percibido he sesenta una mil herencia cinco con euros cuatro,ingreso
abonar electricista cuarenta el por que he aproximadamente euros tenido,gasto
me cobraron dos,gasto
ropa aboné cuatro mil doscientos seis con noventa y nueve euros de,gasto
me cayó mil trescientos,ingreso
el mes pasado me hicieron un ingreso de trescientos sesenta y tres euros por editar un vídeo,ingreso
me dejé al,gasto
farmacia tuve que pagar mil ciento treinta y tres euros ayer en la,gasto
por una devolución me pagaro mil ciento setenta y tres con sesenta y siete euros,ingreso
euros en electricidad,gasto
proyecto me pagaron tres mil novecientos veinticinco con treinta y ocho euros por un,ingreso
cobré trescientos setenta y uno con cuarenta y cuatro euros por un trabajo freelance,ingreso
el trescientos seguro dos del y he desembolsado coche el euros de lunes,gasto
y dos euros de el cerrajero en abril aboné setenta,gasto
gasté trescientos doce,gasto
pagamos doscientos cuarenta y,gasto
mudanza me cobraron más o menos doscientos setenta y seis con noventa y siete euros en una,gasto
he desembolsado mil,gasto
factura del agua,gasto
el con treinta costó gimnasio noventa setecientos siete y ocho me mil y,gasto
pagué cuarenta y ocho,gasto
trabajo el mil tres euros diseño dieciocho ayer cobré setecientos de,ingreso
veintinueve euros por una apuesta ganada hoy he cobrado,ingreso
obtuve novecientos noventa y,ingreso
el mes pasado me entraro setenta y cinco euros de una devolución de hacienda,ingreso
transferido cuatrocientos euros por el trabajo me han,ingreso
por una transferencia me cayeron mil ochocientos veintisiete euros,ingreso
me ingresaron mil ochenta,ingreso
euros me por de cena doscientos salió grupo,gasto
me han abonado dos mil doscientos euros de la liquidación,ingreso
de una venta me ingresaro mil cincuenta y cinco con veintiséis euros,ingreso
de una herencia,ingreso
en la compra he soltado mil ciento cuarenta y tres euros,gasto
el euros tuve ochenta seiscientos y que un pagar seis de lunes,gasto
he ingresado al final quinientos once con noventa y ocho euros de una paga atrasada,ingreso
euros el supermercado,gasto
la mil me en gasté cuatro euros compra y con once,gasto
mil ochocientos cincuenta y cuatro euros por una venta ingresé tres,ingreso
flores pagado he y cuatro cuarenta noventa euros con en semana setecientos y esta,gasto
pagué dos mil cuatrocientos,gasto
me gasté ciento cincuenta y seis con sesenta y uno euros en una suscripción,gasto
pagamos trescientos cincuenta y dos euros este mes en el impuesto de circulación,gasto
me costó mil cuatrocientos cincuenta y cinco con ochenta y cinco euros por la factura de la luz esta tarde,gasto
he percibido tres,ingreso
me cobraro cuatrocientos noventa y dos euros este mes en la compra del supermercado,gasto
en el supermercado,gasto
habitación esta semana me abonó veinticinco euros por alquilar una,ingreso
euros en electricidad,gasto
para el gato he gastado dos mil ciento noventa y siete con sesenta y tres euros este mes en arena,gasto
recibí euros ochocientos laboral indemnización de mil,ingreso
revisión del coche,gasto
he cobrado novecientos noventa,ingreso
marzo me abonaron cuatro mil ochocientos ochenta y cuatro euros de intereses en,ingreso
durante el finde,gasto
suscripción me costó setecientos setenta y siete con cuarenta y uno euros una,gasto
en la euros mes el pasado once solté trescientos,gasto
gaste cien en comida,gasto
vuelo esta tarde me tocó pagar cuatro mil ciento sesenta y cuatro euros en un,gasto
me cayeron setecientos noventa,ingreso
icloud me han cobrado noventa y nueve euros de,gasto
seguro por fin,ingreso
de menos me fin más por han y euros por mil novecientos trabajo nueve el diseño pagado treinta,ingreso
euros en gasolina me cobraron cuatro mil cuatrocientos noventa y seis,gasto
me han transferido,ingreso
recibí cuatro mil,ingreso
suscripción aboné tres mil trescientos ochenta y tres con veintitrés euros de una,gasto
he desembolsado mil,gasto
mil nueve de beca una ciento euros seis con recibí ochenta,ingreso
he cobrado doscientos,ingreso
un trabajo freelance,ingreso
bonus he percibido dos mil ochocientos cuarenta y dos euros por un,ingreso
se me ingresaron doscientos ochenta y seis euros de la devolución del seguro ayer,ingreso
me abonaro más o menos doscientos diecinueve euros por un artículo publicado,ingreso
cuatrocientos dieciséis euros de la devolución del seguro por fin me ingresaron,ingreso
de cumpleaños hoy,ingreso
me costó cuarenta y,gasto
percibido treinta y una cuatro mil euros tres por novecientos devolución,ingreso
me cobraron seiscientos,gasto
pagué setecientos euros,gasto
acabé pagando cuatrocientos cincuenta y cinco euros esta semana en diésel,gasto
taller del coche me cobró doscientos euros el,gasto
me han transferido,ingreso
me tocó pagar,gasto
gaste mil,gasto
bruto por fin,ingreso
fueron cuatro mil quinientos setenta y cinco con sesenta y ocho euros en gasolina se me,gasto
ciento sesenta y seis con veintitrés euros de la devolución del irpf recientemente me abonó,ingreso
me dejé setenta y siete euros con una mudanza en abril,gasto
me ingresaron mil,ingreso
euros de ropa aboné cuatro mil doscientos seis con noventa y nueve,gasto
wallapop cincuenta en y libros por cinco euros cobré,ingreso
a youtube premium me costó nueve euros la suscripción,gasto
de pensión hoy me han transferido seiscientos veintinueve euros,ingreso
me cayeron mil quince con ochenta y uno euros de una paga atrasada,ingreso
me cobraro dos mil quinientos veintiséis con noventa y uno euros en un vuelo,gasto
tuve que pagar quinientos,gasto
de una herencia,ingreso
un trabajo freelance,ingreso
por una venta,ingreso
me costó nueve,gasto
solté mil diecinueve,gasto
dos euros por la switch que he vendido he ganado,ingreso
me han soltado ciento,ingreso
me cayeron dos mil,ingreso
me ingresaro dos mil,ingreso
me ingresaron cien,ingreso
me ingresaron mil quinientos veintiocho euros de una herencia,ingreso
siete y treinta ochenta me costó con euros tres gasolina ochocientos,gasto
me ingresaron cien en gasolina,ingreso
siete desembolsado euros en mil he tres súper casi treinta y el,gasto
he ingresado dos,ingreso
euros una cena,gasto
gasté trescientos cincuenta euros,gasto
me pagaron ciento setenta,ingreso
ochocientos treinta y siete con treinta y uno euros por una beca me pagaron,ingreso
invertí ochocientos cincuenta,gasto
y y con coche euros setenta costó ochocientos siete me setenta uno,gasto
aboné cuatro mil,gasto
me gasté mil trescientos veintidós con veintiocho euros en una suscripción,gasto
me pagaron mil seiscientos setenta y uno con cincuenta y tres euros por una transferencia,ingreso
gasolina pagué quinientos sesenta y dos con once euros por,gasto
diecisiete euros del alquiler vacacional recientemente entraron setecientos,ingreso
me costó mil,gasto
recibí cuatrocientos catorce euros de una apuesta,ingreso
de la tarjeta me han abonado noventa euros de cashback,ingreso
me costó cincuenta,gasto
mil quinientos euros por vender el coche antiguo cobré cuatro,ingreso
me han abonado,ingreso
noventa y me transferencia euros de ochocientos y con setenta abonado una han mil nueve,ingreso
he percibido dos,ingreso
beca me han abonado dos mil doscientos ochenta y cinco con ochenta y seis euros de una,ingreso
me han euros cinco cuarenta hbo de cobrado,gasto
de una bonificación,ingreso
mudanza y abril en euros setenta me con siete una,gasto
factura del agua me cobraron mil novecientos cincuenta y nueve con veinte euros para pagar la,gasto
marzo invertí quinientos noventa y cuatro euros por clases de inglés en,gasto
trescientos impartir ocho por euros hoy curso cuarenta percibí un,ingreso
taller del coche se me fueron tres mil ochocientos cincuenta y dos euros para pagar el,gasto
un texto corto cobré ochenta y cinco euros por traducir,ingreso
me gasté ciento,gasto
acabé pagando mil cuatrocientos cuatro con sesenta y nueve euros para pagar videojuegos,gasto
euros en ropa,gasto
me cayeron dos mil seiscientos sesenta euros por un trabajo freelance,ingreso
recibí cuatrocientos cuarenta,ingreso
por una herencia,ingreso
me tocó pagar,gasto
me pagaron cuatro mil,ingreso
y cuatro pagué con mil euros cincuenta setecientos cuatro cuatro alquiler por y el,gasto
y mil cincuenta euros trescientos proyecto uno recibí un con de cincuenta y seis,ingreso
desembolsé mil seiscientos,gasto
cuatro mil cuatrocientos treinta y seis con veinte euros por una beca he percibido,ingreso
un trabajo freelance ingresé trescientos cincuenta y ocho con noventa y tres euros por,ingreso
mil ochocientos doce euros para pagar un taxi solté dos,gasto
he desembolsado tres,gasto
de ayuda se recientemente me euros setenta ingresaron,ingreso
entraron casi ciento,ingreso
por cargado me de han transferencia comisión euros,gasto
he percibido dos,ingreso
ingresé catorce por tres treinta una con mil euros,ingreso
tuve que pagar,gasto
dos mil uno con dieciocho euros de nómina me ingresaron,ingreso
ochocientos bonus euros por tres un cobré mil,ingreso
cuarenta que tuve euros trescientos una y uno treinta en esta mañana mudanza con,gasto
me han pagado trescientos ochenta euros por traducir un documento,ingreso
setecientos noventa y uno euros de el coche aboné mil,gasto
ingresé mil ochocientos quince con treinta y cinco euros por un bonus,ingreso
llegaron veinte euros de me trescientos,ingreso
ingresaron se paga euros y me tres una setecientos atrasada cuarenta,ingreso
me cayeron dos mil quinientos setenta y siete con noventa y seis euros por una ayuda,ingreso
prestación por desempleo me ingresaro ochocientos euros de la,ingreso
un portátil recientemente me han cargado cuatro mil seiscientos treinta y uno euros en,gasto
fin entraron casi ciento sesenta y cuatro euros de salario bruto por,ingreso
cincuenta y nueve con seis euros por el supermercado pagué mil,gasto
por una beca he percibido mil quinientos euros,ingreso
una ciento recibí euros mil tres doce de,ingreso
tráfico pagué trescientos euros de multa de,gasto
me costó seiscientos cuarenta,gasto
alrededor de mil ochocientos catorce con setenta y dos euros por un proyecto de desarrollo web me abonó,ingreso
treinta y euros tres habitación mes cuatrocientos por este alquilar recibí dieciocho una,ingreso
trabajo de diseño,ingreso
me abonaro cuatro mil ochocientos ochenta y cuatro euros de intereses en marzo,ingreso
euros una venta siete mil noventa y sesenta por con dos quinientos,ingreso
por el ibi pagué en total trescientos sesenta y cinco con cincuenta y nueve euros,gasto
he ochenta con ciento percibido mil y ocho euros bonus por un,ingreso
me pagaron cuatro mil ochocientos ochenta y cuatro euros por vender el ordenador de mesa esta semana,ingreso
por móvil final vender cincuenta obtuve fin viejo cuatro y por mil el doscientos al,ingreso
me pagaron cuatro,ingreso
amazon euros devolución de recibí ochenta de la,ingreso
se me fueron,gasto
me han abonado,ingreso
euros el supermercado me costó cuarenta y ocho con veintinueve,gasto
ingresé trescientos cincuenta y ocho con noventa y tres euros por un trabajo freelance,ingreso
de venta cinco han cuatro me abonado noventa tres mil euros una doscientos con,ingreso
tuve que pagar cuatrocientos setenta y siete con noventa y seis euros para pagar la comida fuera,gasto
reclamación por banco treinta recibí de ciento euros reembolso,ingreso
tren billete quinientos de en un gasté,gasto
mil cuatro con diecinueve por cuatro euros noventa una y doscientos cobré,ingreso
supermercado pagué tres mil doscientos treinta euros por el,gasto
y dos euros por una deuda pendiente esta semana recibí cincuenta,ingreso
desembolsé más o,gasto
y desembolsado mil dentista he el sesenta con dos tres novecientos y euros dos noventa,gasto
y uno en seis cuarenta noventa he euros pagado y el dentista mil con,gasto
y euros nueve en mes gasté setenta este hipoteca,gasto
recibí mil ciento ochenta y seis con nueve euros de una beca,ingreso
cuatro quinientos setenta costó y electricidad veintidós euros ocho con mil,gasto
sesenta y ocho euros por un bonus cobré quinientos,ingreso
mes en impuestos me cobraro ochenta y nueve euros este,gasto
me cayeron quinientos,ingreso
reparación pagué tres mil doscientos dos euros por una,gasto
bancaria gasté mil setecientos setenta y ocho con cuarenta y ocho euros para pagar una comisión,gasto
mes cobré mil ochocientos euros de nómina este,ingreso
ingresé cuatro mil,ingreso
una dos sesenta mil ocho y euros y me con ingresaron de apuesta,ingreso
he ingresado al,ingreso
clínico este mes me abonó mil ochocientos quince con cuarenta y cuatro euros por participar en un estudio,ingreso
he percibido setecientos,ingreso
me abonaron aproximadamente,ingreso
y euros una sesenta siete percibido he cincuenta por y beca con trescientos,ingreso
me costó setecientos setenta y siete con cuarenta y uno euros una suscripción,gasto
de una venta me ingresaron cuatro mil setecientos sesenta y tres con cincuenta y nueve euros,ingreso
semana este trimestre he soltado tres mil sesenta y seis euros de una escapada de fin de,gasto
mil cuatrocientos noventa y tres con treinta y nueve euros por el coche pagué tres,gasto
mañana tuve que pagar cuatro mil doscientos cincuenta y cinco euros con el veterinario esta,gasto
me pagaro trescientos cincuenta,ingreso
apuesta ganada ayer he cobrado novecientos noventa con cuarenta y uno euros por una,ingreso
final seiscientos setenta y dos con cincuenta y nueve euros en un hotel invertí al,gasto
novecientos setenta y uno euros ropa me costó,gasto
aboné mil novecientos cuatro,gasto
en el supermercado he soltado dos mil novecientos cuatro con quince euros,gasto
el más euros en y ochenta taller quinientos pagando coche o menos del tres,gasto
me costó tres,gasto
he pagado dos mil seiscientos treinta y siete con noventa y cinco euros en electricidad,gasto
un bizum de cincuenta euros por la cena me mandaron,ingreso
por ochenta euros bizum me ciento han mandado la de cena,ingreso
solté veintiuno euros este,gasto
cobrado cincuenta euros de penalización por retraso me han,gasto
me salió por ciento,gasto
diseño por fin me han pagado más o menos mil novecientos treinta y nueve euros por el trabajo de,ingreso
me pagaron seiscientos,ingreso
aeropuerto cincuenta de cinco taxi al y pagué,gasto
he desembolsado cuatrocientos,gasto
euros el gimnasio,gasto
he recibido cuatro mil novecientos cuarenta y ocho euros por el trabajo de diseño el otro día,ingreso
cuarenta y cuatro con sesenta y siete euros en el gimnasio me gasté,gasto
me abonó sesenta y nueve euros de comisión por ventas este mes,ingreso
me pagaron cuatro mil,ingreso
venta me ingresaron dos mil quinientos veinticinco euros de una,ingreso
dos mil seiscientos setenta y cinco euros en el dentista me gasté,gasto
setecientos setenta y siete con cuarenta y uno euros una suscripción me costó,gasto
nómina se me ingresaron aproximadamente mil ochocientos veintiocho con treinta y tres euros de,ingreso
de una venta,ingreso
he cobrado ciento doce,ingreso
me costó cuatro,gasto
tres pagado gasolina he tres en euros ochenta mil,gasto
recibí mil cuatrocientos cuarenta,ingreso
y euros noventa ochocientos cincuenta venta dos una siete por con mil siete ingresé,ingreso
me ingresaro mil quinientos veintiocho euros de una herencia,ingreso
me llegó el,ingreso
me hicieron un,ingreso
me cayeron noventa y,ingreso
una bici hoy se me ingresaron treinta con treinta y dos euros por vender,ingreso
ropa solté dos mil trescientos veinticinco euros este mes en,gasto
un regalo recientemente acabé pagando dos mil setecientos cuarenta y siete euros con,gasto
recibí treinta y,ingreso
por un proyecto,ingreso
me cobraro doscientos cuarenta y ocho euros en un vuelo,gasto
recibí mil trescientos,ingreso
me han pagado,ingreso
trece setenta por y una me ochocientos pagaron con venta tres ocho mil,ingreso
en una suscripción,gasto
euros por nómina cobré seiscientos ochenta y cinco con sesenta y siete,ingreso
me cobraron sesenta,gasto
veintitrés euros por tutorías online obtuve unos,ingreso
me han pagado,ingreso
me han cargado,gasto
me cayeron doscientos veinte euros por las horas extra del trabajo,ingreso
por quinientos y euros transferencia ingresé mil setenta seis nueve con dos y una,ingreso
ciento vacacional he del euros recibido dos noventa sesenta con alquiler,ingreso
se me ingresaron setenta euros de ayuda escolar recientemente,ingreso
euros por gasolina pagué cuatrocientos dieciséis,gasto
me abonaro setecientos euros,ingreso
transferido más o menos cuatrocientos setenta y cinco euros por traducir un documento me han,ingreso
una boda recientemente he percibido veintiocho euros por hacer fotos en,ingreso
en una suscripción,gasto
tres cincuenta siete aboné de y cuatro euros cena con y mil una cincuenta,gasto
me hicieron un ingreso,ingreso
una sesenta mil doscientos familiar cuatro cuatro percibido he y transferencia euros,ingreso
obtuve más o,ingreso
y esta treinta euros el cuatrocientos tres electricista con invertí,gasto
me han cargado,gasto
dos mil novecientos cuatro con quince euros en el supermercado he pagado,gasto
súper este mes,gasto
recibí cuatro mil novecientos,ingreso
tres mil seiscientos cincuenta euros en el supermercado me gasté,gasto
aboné mil novecientos,gasto
coche me costó mil quinientos quince euros el,gasto
pagué doscientos treinta y,gasto
reparación aboné mil novecientos cuatro con cincuenta y cinco euros de una,gasto
ingresé dos mil,ingreso
por una venta me cayeron cuatro mil novecientos noventa y cuatro euros,ingreso
se me fueron,gasto
pagué ciento cincuenta y,gasto
euros con cobré una y por mil beca y cuatro cincuenta nueve,ingreso
noventa se el me fueron veterinario en,gasto
he desembolsado mil ochocientos,gasto
me han abonado dos mil ciento veintinueve euros de una devolución,ingreso
con ochenta fueron cincuenta gasolina y mil doscientos euros ocho en dos se,gasto
en el coche me cobraro seiscientos cincuenta con ochenta euros,gasto
en una cena,gasto
ciento al obtuve ocho alquiler euros de mes la sesenta ayuda este,ingreso
pasada cobré tres mil trescientos setenta euros de la venta de libros usados la semana,ingreso
impuestos cincuenta ochocientos invertí de y tres euros,gasto
me dejé trescientos,gasto
usados la venta ciento libros cuarenta de ingresé euros,ingreso
pagué catorce euros de,gasto
euros extraordinaria me cuatro con cinco este y pagaron novecientos y paga treinta de mes,ingreso
apuesta por euros uno una novecientos he mil tres,ingreso
por un proyecto cobré tres mil ciento noventa con ochenta euros,ingreso
me han abonado mil,ingreso
gasté de cinco en euros y oficina noventa,gasto
la semana pasada se fueron treinta y dos euros con netflix,gasto
veterinario este mes me cobraro ochenta y uno euros de el,gasto
me ingresaron mil,ingreso
ropa de temporada desembolsé trescientos euros en,gasto
he desembolsado tres,gasto
por mi cumpleaños recibí doscientos cincuenta euros de mi abuelo,ingreso
euros pendiente y por esta cincuenta semana una dos recibí,ingreso
euros más tejado veintiuno o menos en el solté,gasto
bonus me con veintiuno ingresaron y de ciento sesenta cinco un,ingreso
cinco noventa ochenta con subvención cuatro y de euros me y ingresaron esta cuatrocientos semana dos una,ingreso
cargado cuarenta y seis euros para pagar el alquiler me han,gasto
para la gasolina le pasé cien euros a mi hermano,gasto
cuatro cuatrocientos en una euros ochenta desembolsado mil cena,gasto
un setenta cuatrocientos abonado proyecto tres euros han mil de me con dieciocho dos,ingreso
se me fueron,gasto
euros por gasolina pagué quinientos sesenta y dos con once,gasto
me pagaron dos,ingreso
mil por con euros gimnasio cinco y noventa dos el pagué y sesenta,gasto
al final trescientos treinta y cuatro euros de una venta en vinted me pagaron,ingreso
fueron finde y me cuenta de treinta el durante cinco por se euros el la,gasto
me han abonado,ingreso
por una beca me cayeron dos mil quinientos ocho con cincuenta y uno euros,ingreso
ochocientos y por tres con mil setenta y ingresé cinco devolución cuatro sesenta una,ingreso
pagué alrededor de,gasto
me cayeron cuatro mil,ingreso
obtuve dos mil ciento,ingreso
aboné mil doscientos treinta y uno euros de ropa,gasto
he desembolsado dos,gasto
bonus euros tres mil ciento un cuarenta tres con por setenta y cobré tres,ingreso
ingresé noventa y cinco,ingreso
perro he pagado seiscientos cincuenta y cinco con veinticuatro euros ayer en comida para el,gasto
ingresé tres mil,ingreso
el euros se este gimnasio setenta fueron de,gasto
he desembolsado cuatrocientos,gasto
me pagaron cincuenta y seis euros por un reportaje fotográfico esta semana,ingreso
devuelto ochenta euros por la reserva cancelada me han,ingreso
pagué alrededor de trescientos sesenta y tres euros en el ibi,gasto
una cuatro y ochenta con cuatro he treinta mil pagado y quinientos en uno suscripción,gasto
novecientos veintidós mes este seguro abonó me de euros del devolución,ingreso
recientemente me cayó veintinueve euros por trabajo de consultoría,ingreso
una hacer en boda recientemente por fotos veintiocho he euros,ingreso
recibí quinientos euros de devolución de hacienda,ingreso
multa en marzo,gasto
se me fueron,gasto
beca me pagaron dos mil quinientos ocho con cincuenta y uno euros por una,ingreso
de familiar siete cuarenta una recibí quince ayer y con transferencia cuatrocientos,ingreso
mil quinientos cuatro euros ayer en un tren invertí dos,gasto
ochocientos me mil quince cena costó una,gasto
me quitaron cien,gasto
en amazon prime,gasto
euros ayer en parking solté diecisiete,gasto
flores el viernes me dejé cuatrocientos cuarenta y ocho euros en,gasto
cobré cuatro mil,ingreso
le he pasado,gasto
de cumpleaños cincuenta de regalo recibí ciento,ingreso
tres transferido euros once han cincuenta novecientos hoy pensión y con de,ingreso
por una transferencia me cayeron tres mil ochocientos uno con treinta y cuatro euros,ingreso
freelance cobré mil ochocientos cuarenta y ocho con sesenta euros por un trabajo,ingreso
ingresé noventa y,ingreso
euros de nómina recibí mil setecientos sesenta con cincuenta y cuatro,ingreso
de una transferencia,ingreso
me han cargado,gasto
recientemente he percibido veintiocho euros por hacer fotos en una boda,ingreso
por el gimnasio,gasto
me pagaron dos mil,ingreso
ingresé quinientos euros,ingreso
por el coche pagué tres mil cuatrocientos noventa y tres con treinta y nueve euros,gasto
en el veterinario desembolsé más o menos ochenta euros,gasto
me pagaro mil novecientos,ingreso
gasté veintidós euros en una planta para casa,gasto
ingresé dos mil cuatrocientos,ingreso
trescientos cincuenta euros por el proyecto freelance me pagaron,ingreso
dieciséis euros por gasolina pagué cuatrocientos,gasto
abonado tres mil ciento cuarenta y siete euros de una beca me han,ingreso
he tenido que,gasto
desembolsado en euros el treinta con coche once mil he,gasto
me pagaron ochocientos ochenta,ingreso
he desembolsado dos mil doscientos setenta y nueve con sesenta y siete euros en ropa,gasto
canguro este mes,ingreso
transferencia cobré una treinta ochocientos mil euros y uno cuatro con ochenta,ingreso
deuda pendiente hoy,ingreso
me gasté cuatro mil setecientos setenta y siete con cuarenta y cinco euros en ropa,gasto
he cobrado ciento,ingreso
un artículo publicado,ingreso
mil novecientos treinta y uno euros por una transferencia ingresé tres,ingreso
me gasté ochocientos,gasto
beca ingresé dos mil seiscientos sesenta y cuatro con cuarenta y ocho euros por una,ingreso
cobré tres mil cuatrocientos,ingreso
alquiler novecientos euros cincuenta este mes de he,gasto
me entraro noventa y,ingreso
me salió por,gasto
cuatro con novecientos mil cobraron treinta me el gimnasio en once,gasto
en una suscripción,gasto
mil ochocientos setenta y cinco euros por una transferencia he percibido,ingreso
por un bonus ingresé mil ocho euros,ingreso
electricidad se me fueron tres mil ochocientos sesenta con dieciséis euros en,gasto
he gastado dieciséis,gasto
euros con aire acondicionado el lunes pagué trece,gasto
me han soltado ochocientos,ingreso
tuve que pagar,gasto
cobré por beca mil euros veinticuatro cuatrocientos tres,ingreso
me tocó pagar,gasto
me han abonado cuatro mil novecientos siete con veinticuatro euros de una transferencia,ingreso
vuelo un en euros tres y con cinco desembolsado he sesenta cincuenta y,gasto
venta trece ocho ochocientos tres con por pagaron y una setenta mil euros,ingreso
se me fueron,gasto
en el supermercado me cobraron dos mil cuatrocientos ochenta y ocho con ochenta y uno euros,gasto
cincuenta he pendiente por deuda una y euros nueve percibido mil,ingreso
de una apuesta,ingreso
entraro dos mil ciento cincuenta con treinta y cinco euros de la ayuda al alquiler en febrero,ingreso
la semana pasada solté ochenta y siete euros en el ibi,gasto
ayer acabé ocho con treinta pagando y y doscientos cena dos la en euros,gasto
me han transferido trescientos setenta y cuatro con sesenta y uno euros de la prestación por desempleo este mes,ingreso
cobré tres mil seiscientos veintiuno con trece euros por un trabajo freelance,ingreso
taxi al aeropuerto pagué cincuenta y cinco euros de,gasto
me abonó novecientos veintidós,ingreso
gasté noventa euros en,gasto
bonus he percibido dos mil doscientos ochenta y nueve con veinticinco euros por un,ingreso
